Question,Answer
What should I know about measles?,"Symptoms include fever, cough, runny nose, and a red rash on the skin. If you notice these signs, take the baby to the hospital."
When should how do i treat a baby's cough?,"Gently wipe the baby's nose, ensure good air circulation, and if the cough is severe, see a doctor."
Why does avoid getting a breast infection (mastitis)?,"Clean your breasts before and after breastfeeding, drink plenty of water, and avoid hot environments."
What should I know about blood pressure?,"Currently, there is no high blood pressure vaccine for babies. Take care of the baby's health through good nutrition and regular check-ups."
What is breastfeeding?,"Wash your hands before breastfeeding, avoid contaminating the nipple, and check for swelling or pain."
Can you explain when should you start teaching a baby about personal hygiene?,"You can start by teaching them to wash their hands, clean their mouth, etc., from 1.5 to 2 years old."
When should menstrual cycle?,"A woman can get pregnant 5 days before ovulation and on the day of ovulation, which is in the middle of the menstrual cycle."
What are the signs of how can the risk of vomiting and diarrhea in babies be reduced?,"Ensure food hygiene, hand hygiene, and breastfeed the baby. Also, make sure they receive the rotavirus vaccine."
What is measles?,"Yes, the measles vaccine helps protect the baby from getting measles. Follow the vaccination schedule provided by the doctor."
Why does the most suitable food for a baby at six months?,"Start with soft foods like mashed potatoes, bananas, cooked carrots, and other mashed vegetables."
What is mucus?,"A lot of mucus can be a sign of a cold, a lung problem, or something in the nose. Take them to the hospital if it persists."
What is is it appropriate to give a baby sweets or sugary drinks?,No. Sweets and sugary drinks are not good for babies and can cause tooth decay and reduce their appetite for healthy food.
When should can a pregnant woman exercise?,"Yes, light exercise like walking is beneficial, but consult a doctor before starting."
What should I know about when should a baby start sitting up on its own?,"Babies usually start sitting up on their own between 4 and 7 months, but this varies among children."
What should I know about headache?,Consult a doctor immediately to be checked.
What is blood pressure?,"Currently, there is no high blood pressure vaccine for babies. Take care of the baby's health through good nutrition and regular check-ups."
What are the signs of swelling?,"Rest with your legs elevated, drink plenty of water, exercise lightly, and avoid eating too much salt."
Why does hygiene?,"Ensure hand hygiene before touching the baby, avoid large gatherings, and follow the given health guidelines."
What are the signs of my baby has a severe cough?,See a doctor immediately for treatment.
Why does my baby have a fever after vaccination?,"A fever after vaccination is normal and indicates that the vaccine is working. If the fever is high, consult a doctor."
How do I can a baby be left to sleep with a bottle in their mouth?,No. This can cause tooth decay and fluid to enter the ear. Feed them before bed and then clean their mouth.
How do I my baby have a lot of facial acne?,"Facial acne in babies can be due to a new hormonal balance. If they are not inflamed or swollen, there is no need to worry."
What is cough?,"Ensure cleanliness in the play area, practice hand washing, and avoid contact with children who have a cold or cough."
What is a mother feel pain during childbirth?,Labor pain occurs because the uterus contracts to push the baby out.
Tell me about mucus?,"A lot of mucus can be a sign of a cold, a lung problem, or something in the nose. Take them to the hospital if it persists."
Is it true that can a baby be vaccinated if they have a fever?,"If the fever is mild, the vaccination is usually continued. But if it is high or there is pain, it is postponed until they recover."
What is how do i know if my baby has an earache?,"Signs include frequent rubbing of the ear, crying at night, vomiting, or loss of appetite. Take them to the hospital if you suspect this."
What is earache?,"Signs include frequent rubbing of the ear, crying at night, vomiting, or loss of appetite. Take them to the hospital if you suspect this."
Is it true that nutrition?,Low weight in a baby can be the result of insufficient nutrition or illness. Consult a doctor for advice and treatment.
How do I jaundice?,"Jaundice occurs when the baby's blood is full of bilirubin, causing the eyes and skin to turn yellow. It requires a doctor's check-up."
Is it true that can a baby be left to sleep with a bottle in their mouth?,No. This can cause tooth decay and fluid to enter the ear. Feed them before bed and then clean their mouth.
Why does jaundice?,"Jaundice occurs when the baby's blood is full of bilirubin, causing the eyes and skin to turn yellow. It requires a doctor's check-up."
How do I fever?,"A fever after vaccination is normal and indicates that the vaccine is working. If the fever is high, consult a doctor."
What are the signs of earache?,See a doctor to have it checked.
What is polio?,"Symptoms include weakness or paralysis of a leg or arm. If you notice these signs, take the baby to the hospital immediately."
Is it true that my baby vomit a lot after eating?,"They may be eating too much, or have a stomach problem. Pay attention to the type and amount of food you are giving them."
Can you explain tuberculosis?,"Yes, the tuberculosis vaccine helps protect the baby from the disease. Follow the vaccination schedule provided by the doctor."
How can I prevent cough?,"Symptoms include fever, cough, runny nose, and a red rash on the skin. If you notice these signs, take the baby to the hospital."
What are the signs of can a pregnant woman exercise?,"Yes, light exercise like walking is beneficial, but consult a doctor before starting."
What are the signs of nutrition?,Low weight in a baby can be the result of insufficient nutrition or illness. Consult a doctor for advice and treatment.
What are the signs of measles?,A persistent cough can indicate diseases like measles or pneumonia. Take the baby to the hospital immediately if the cough lasts for more than 5 days.
Tell me about vaccination?,Vaccination protects the baby from dangerous diseases like polio and tetanus.
When should is it appropriate to vaccinate my baby against tuberculosis?,"Yes, the tuberculosis vaccine helps protect the baby from the disease. Follow the vaccination schedule provided by the doctor."
Is it true that what prevents a woman from getting pregnant?,"Causes include hormonal problems, uterine problems, or diseases. You should see a doctor for treatment."
How do I meningitis?,The meningitis vaccine is given from 6 months of age or as prescribed by a doctor according to the vaccination calendar.
What are the signs of when will a woman's period return after childbirth?,"The period usually returns between 6 weeks and 6 months after childbirth, especially if the woman is not breastfeeding."
Hi,"Hey, how can I help "
Hey,Hey there! How can I help you today?
Hello,Hello! How can I assist you today?
